{"artifacts":[{"absolute_path_count":0,"absolute_path_findings":[],"absolute_path_findings_redacted":false,"byte_count":89529,"family":"audit","id":"ART-AUDIT-AMY-RAW-20260713","kind":"file","member_count":1,"non_git_member_count":0,"path":"audit/AMY_DEEP_AUDIT_RAW_2026-07-13.json","public_packet":false,"reason":"Dated read-only A.M.Y snapshot retained with its original validation; later source drift means it is historical, not current.","source_git":true,"status":"historical_valid","tree_sha256":"2bfd9d24094c8c5c917dfb1c5b553f45fc3a6ad90c965b06e9ab86c4abf8f864","validator":{"invocation":"python scripts/validate_amy_audit.py","kind":"executable","path":"scripts/validate_amy_audit.py"}},{"absolute_path_count":0,"absolute_path_findings":[],"absolute_path_findings_redacted":false,"byte_count":1349,"family":"audit","id":"ART-AUDIT-AMY-VALIDATION-20260713","kind":"file","member_count":1,"non_git_member_count":0,"path":"audit/AMY_DEEP_AUDIT_VALIDATION_2026-07-13.json","public_packet":false,"reason":"Original same-environment replay record for the dated A.M.Y audit; retained without representing the present worktree.","source_git":true,"status":"historical_valid","tree_sha256":"27d449a286b1e0f7f6b3e520b291ed8bee7fc91e6a0c485bd24db8a0460dac2a","validator":{"invocation":"python scripts/validate_amy_audit.py","kind":"executable","path":"scripts/validate_amy_audit.py"}},{"absolute_path_count":1,"absolute_path_findings":[{"member_path":".","syntax":"posix"}],"absolute_path_findings_redacted":false,"byte_count":14264,"family":"audit","id":"ART-AUDIT-AMY-PAPER-REPORT-20260713","kind":"file","member_count":1,"non_git_member_count":0,"path":"audit/AMY_SYSTEM_PAPER_CODE_DATA_PDF_AUDIT_2026-07-13.md","public_packet":false,"reason":"Human-readable report bound to the dated system-paper audit and retained as historical analysis rather than current evidence.","source_git":true,"status":"historical_valid","tree_sha256":"e874b2e6e7be2a55f1e7a4cda773387aaa93ec121479205f4ed8c9f911804105","validator":{"invocation":"pytest -q tests/test_system_paper_integrity_audit.py","kind":"pytest","path":"tests/test_system_paper_integrity_audit.py"}},{"absolute_path_count":0,"absolute_path_findings":[],"absolute_path_findings_redacted":false,"byte_count":53680,"family":"audit","id":"ART-AUDIT-AMY-PAPER-RAW-20260713","kind":"file","member_count":1,"non_git_member_count":0,"path":"audit/AMY_SYSTEM_PAPER_DEEP_AUDIT_RAW_2026-07-13.json","public_packet":false,"reason":"Dated machine-readable system-paper snapshot preserved with explicit historical scope and no current-byte claim.","source_git":true,"status":"historical_valid","tree_sha256":"4971aa68e97bc30929236b321943409d748b08090f8ead50a5952c031b71ef29","validator":{"invocation":"python scripts/validate_system_paper_audit.py","kind":"executable","path":"scripts/validate_system_paper_audit.py"}},{"absolute_path_count":0,"absolute_path_findings":[],"absolute_path_findings_redacted":false,"byte_count":1501,"family":"audit","id":"ART-AUDIT-AMY-PAPER-VALIDATION-20260713","kind":"file","member_count":1,"non_git_member_count":0,"path":"audit/AMY_SYSTEM_PAPER_DEEP_AUDIT_VALIDATION_2026-07-13.json","public_packet":false,"reason":"Original canonical replay result for the dated system-paper audit, retained without retroactive rewriting.","source_git":true,"status":"historical_valid","tree_sha256":"f7e7641a2ad619696826e4ce90231d3325439a85328ac3c302be2e921a7a98c5","validator":{"invocation":"python scripts/validate_system_paper_audit.py","kind":"executable","path":"scripts/validate_system_paper_audit.py"}},{"absolute_path_count":1,"absolute_path_findings":[{"member_path":".","syntax":"posix"}],"absolute_path_findings_redacted":false,"byte_count":32523,"family":"audit","id":"ART-AUDIT-ATLAS-RAW-20260713","kind":"file","member_count":1,"non_git_member_count":0,"path":"audit/ATLAS_DEEP_AUDIT_RAW_2026-07-13.json","public_packet":false,"reason":"Dated ATLAS code-and-artifact snapshot retained as historical audit input; current source bytes are outside its claim.","source_git":true,"status":"historical_valid","tree_sha256":"e3f09e0f1bf943094e9d4e090d307c08d005cc940f0917e71213cca9a847ac30","validator":{"invocation":"python scripts/validate_protocol.py","kind":"executable","path":"scripts/validate_protocol.py"}},{"absolute_path_count":0,"absolute_path_findings":[],"absolute_path_findings_redacted":false,"byte_count":1109,"family":"audit","id":"ART-AUDIT-ATLAS-VALIDATION-20260713","kind":"file","member_count":1,"non_git_member_count":0,"path":"audit/ATLAS_DEEP_AUDIT_VALIDATION_2026-07-13.json","public_packet":false,"reason":"Original same-environment validation for the dated ATLAS snapshot; it is retained as provenance, not a current replay.","source_git":true,"status":"historical_valid","tree_sha256":"5cdbaa79671adddca1977117c0cb3cc377f76449a86c2d2fd33e02ed32cf6f69","validator":{"invocation":"python scripts/validate_protocol.py","kind":"executable","path":"scripts/validate_protocol.py"}},{"absolute_path_count":0,"absolute_path_findings":[],"absolute_path_findings_redacted":false,"byte_count":13761,"family":"audit","id":"ART-AUDIT-ATLAS-REPORT-20260713","kind":"file","member_count":1,"non_git_member_count":0,"path":"audit/ATLAS_DEEP_CODE_AND_ARTIFACT_AUDIT_2026-07-13.md","public_packet":false,"reason":"Human-readable ATLAS findings retained with the dated snapshot and bounded to that historical code state.","source_git":true,"status":"historical_valid","tree_sha256":"40f4af565f9a3075a15275579f94848f5993c798abea4c6ca80687afcbe9c7dd","validator":{"invocation":"python scripts/build_artifact_retention_index.py --check","kind":"retention_only","path":"scripts/build_artifact_retention_index.py"}},{"absolute_path_count":0,"absolute_path_findings":[],"absolute_path_findings_redacted":false,"byte_count":71076,"family":"audit","id":"ART-AUDIT-AXIOM-RAW-20260713","kind":"file","member_count":1,"non_git_member_count":0,"path":"audit/AXIOM_DEEP_AUDIT_RAW_2026-07-13.json","public_packet":false,"reason":"Dated AXIOM boundary and artifact snapshot retained as historical evidence of the state actually inspected.","source_git":true,"status":"historical_valid","tree_sha256":"24073089815cfa9bcf195182a79b6f34535c45756bb569c3c264b7e415becb2f","validator":{"invocation":"python scripts/validate_axiom_audit.py","kind":"executable","path":"scripts/validate_axiom_audit.py"}},{"absolute_path_count":0,"absolute_path_findings":[],"absolute_path_findings_redacted":false,"byte_count":1361,"family":"audit","id":"ART-AUDIT-AXIOM-VALIDATION-20260713","kind":"file","member_count":1,"non_git_member_count":0,"path":"audit/AXIOM_DEEP_AUDIT_VALIDATION_2026-07-13.json","public_packet":false,"reason":"Original canonical validation for the dated AXIOM audit; retained without claiming current-worktree equivalence.","source_git":true,"status":"historical_valid","tree_sha256":"0e603a2d8de22752de841864e277132e27911968fdb27280efa2f01e5fe9b7c6","validator":{"invocation":"python scripts/validate_axiom_audit.py","kind":"executable","path":"scripts/validate_axiom_audit.py"}},{"absolute_path_count":1,"absolute_path_findings":[{"member_path":".","syntax":"posix"}],"absolute_path_findings_redacted":false,"byte_count":10752,"family":"audit","id":"ART-AUDIT-AXIOM-REPORT-20260713","kind":"file","member_count":1,"non_git_member_count":0,"path":"audit/AXIOM_DEEP_CODE_ARTIFACT_AND_PAPER_AUDIT_2026-07-13.md","public_packet":false,"reason":"Human-readable AXIOM report retained with the machine-readable dated audit and its bounded historical interpretation.","source_git":true,"status":"historical_valid","tree_sha256":"69a01c06148a93045cc3e80e0fe5a1a43678c482c7d5238e724eefb16ea8b8a6","validator":{"invocation":"pytest -q tests/test_axiom_integrity_audit.py","kind":"pytest","path":"tests/test_axiom_integrity_audit.py"}},{"absolute_path_count":1,"absolute_path_findings":[{"member_path":".","syntax":"posix"}],"absolute_path_findings_redacted":false,"byte_count":10166,"family":"audit","id":"ART-AUDIT-BASELINE-20260713","kind":"file","member_count":1,"non_git_member_count":0,"path":"audit/BASELINE_AUDIT_2026-07-13.md","public_packet":false,"reason":"Initial exploratory baseline retained to document the design chronology; it is not the current project assessment.","source_git":true,"status":"historical_valid","tree_sha256":"c80cfaeef4644861f8cf1f206951fadcdf23987a41b06105d4004a1786b94e97","validator":{"invocation":"python scripts/build_artifact_retention_index.py --check","kind":"retention_only","path":"scripts/build_artifact_retention_index.py"}},{"absolute_path_count":1,"absolute_path_findings":[{"member_path":".","syntax":"posix"}],"absolute_path_findings_redacted":false,"byte_count":14359,"family":"audit","id":"ART-AUDIT-MANUSCRIPTS-REPORT-20260713","kind":"file","member_count":1,"non_git_member_count":0,"path":"audit/LATEST_MANUSCRIPTS_CODE_DATA_PDF_AND_REFERENCE_AUDIT_2026-07-13.md","public_packet":false,"reason":"Human-readable manuscript admissibility report retained with its dated inputs and without a claim about current manuscript bytes.","source_git":true,"status":"historical_valid","tree_sha256":"56b00bc1abe341c9c4c44de7184be6cac0970b9f32c74c4b1377c31bce4b872a","validator":{"invocation":"pytest -q tests/test_latest_manuscripts_audit.py","kind":"pytest","path":"tests/test_latest_manuscripts_audit.py"}},{"absolute_path_count":1,"absolute_path_findings":[{"member_path":".","syntax":"posix"}],"absolute_path_findings_redacted":false,"byte_count":69980,"family":"audit","id":"ART-AUDIT-MANUSCRIPTS-RAW-20260713","kind":"file","member_count":1,"non_git_member_count":0,"path":"audit/LATEST_MANUSCRIPTS_DEEP_AUDIT_RAW_2026-07-13.json","public_packet":false,"reason":"Dated manuscript source-to-claim snapshot preserved as a historical record despite later source drift.","source_git":true,"status":"historical_valid","tree_sha256":"1a2e39aca4ed4e02d3e2aecc732850612a55fb9fd4f6a830ea7aeb5ea55c6abc","validator":{"invocation":"python scripts/validate_latest_manuscripts_audit.py","kind":"executable","pa